{
  "model_version": 20200102082643,
  "study_variation": "messaging-system-personalization-experiment-1-addon-treatment@mozilla.org",
  "study_addon_version": "1.0.0",
  "client_context_features": {
    "has_firefox_as_default_browser": true,
    "active_ticks": 5,
    "total_uri_count": 1,
    "about_preferences_non_default_value_count": 1,
    "self_installed_addons_count": 0,
    "self_installed_popular_privacy_security_addons_count": 0,
    "self_installed_themes_count": 0,
    "dark_mode_active": true,
    "total_bookmarks_count": 5,
    "logins_saved_in_the_browser_count": 0,
    "firefox_account_prefs_configured": false,
    "profile_age_in_ms": 26604,
    "main_monitor_screen_width": 1680,
    "update_channel": "aurora",
    "locale": "en-US"
  },
  "boolean_client_context_features": {
    "has_firefox_as_default_browser": true,
    "has_more_than_12_active_ticks": false,
    "has_more_than_5_total_uri_count": false,
    "has_more_than_1_about_preferences_non_default_value_count": false,
    "has_at_least_one_self_installed_addon": false,
    "has_at_least_one_self_installed_popular_privacy_security_addon": false,
    "has_at_least_one_self_installed_theme": false,
    "dark_mode_active": true,
    "has_more_than_5_bookmarks": false,
    "has_at_least_one_login_saved_in_the_browser": false,
    "firefox_account_prefs_configured": false,
    "profile_more_than_60_days_old": false,
    "main_monitor_screen_width_gt_1280": true,
    "is_release_channel": false,
    "locale_is_en_us": true,
    "locale_is_de": false
  },
  "features_array_used_in_score_computation": [
    1,
    0,
    0,
    0,
    0,
    0,
    0,
    1,
    0,
    0,
    0,
    0,
    1,
    0,
    1,
    0
  ]
}
